### ISSUE TITLE
内置DNS请求回错端口

### ISSUE THREAD

**Issue by dec1985** [v2fly/v2ray-core#929]
## 你正在使用哪个版本的 V2Ray？

4.36.2

## 你的使用场景是什么？

参考白话文指南, tproxy透明代理.

## 你看到的异常现象是什么？

DNS偶尔失败.

客户端IP: 10.6.232.17
服务器IP: 10.6.232.16

每秒dig www2.baidu.com一次, tcpdump发现DNS请求回错了端口, 正常情况下:

ts,srcAddr,srcPort,dstAddr,dstPort,protocol,packetLength
2021-04-23 09:06:21,10.6.232.17,**49166,**10.6.232.16,53,UDP,85
2021-04-23 09:06:21,10.6.232.16,53,10.6.232.17,**49166,**UDP,90

日志发现09:06:22, 09:06:27, 09:06:32(间隔5秒, dig的默认timeout, 15s超时后恢复正常), 请求的端口和回复的端口不一致:
2021-04-23 09:06:22,10.6.232.17,**54269,**10.6.232.16,53,UDP,85
2021-04-23 09:06:22,10.6.232.16,53,10.6.232.17,**15801,**UDP,90
2021-04-23 09:06:27,10.6.232.17,54269,10.6.232.16,53,UDP,85
2021-04-23 09:06:27,10.6.232.16,53,10.6.232.17,31111,UDP,90
2021-04-23 09:06:32,10.6.232.17,54269,10.6.232.16,53,UDP,85
2021-04-23 09:06:32,10.6.232.16,53,10.6.232.17,31111,UDP,90

09:06:22响应回复的15801端口, 其实是之前发请求的端口:
2021-04-23 09:03:35,10.6.232.17,**15801,**10.6.232.16,53,UDP,85
2021-04-23 09:03:35,10.6.232.16,53,10.6.232.17,**15801,**UDP,90
2021-04-23 09:06:22,10.6.232.16,53,10.6.232.17,**15801,**UDP,90

## 请附上你的配置

**服务端配置：**

```javascript
// 在这里附上服务器端配置文件
[root@minibox2 net]# cat /usr/local/etc/v2ray/config.json
{
    "outbounds": [
        {
            "streamSettings": {
                "sockopt": {
                    "mark": 255
                }
            },
            "tag": "direct",
            "protocol": "freedom",
            "settings": {
                "domainStrategy": "UseIPv4"
            }
        },
        {
            "streamSettings": {
                "sockopt": {
                    "mark": 255
                }
            },
            "tag": "proxy",
            "protocol": "socks",
            "mux": {
                "enabled": true
            },
            "settings": {
                "domainStrategy": "UseIPv4",
                "servers": [
                    {
                        "port": 1080,
                        "address": "x.x.x.x"
                    }
                ]
            }
        },
        {
            "streamSettings": {
                "sockopt": {
                    "mark": 255
                }
            },
            "tag": "proxy-hr",
            "protocol": "socks",
            "mux": {
                "enabled": true
            },
            "settings": {
                "domainStrategy": "UseIPv4",
                "servers": [
                    {
                        "port": 1080,
                        "address": "x.x.x.x"
                    }
                ]
            }
        },
        {
            "tag": "block",
            "protocol": "blackhole",
            "settings": {
                "response": {
                    "type": "http"
                }
            }
        },
        {
            "streamSettings": {
                "sockopt": {
                    "mark": 255
                }
            },
            "tag": "dns-out",
            "protocol": "dns"
        }
    ],
    "dns": {
        "hosts": {
            "xxxxxx.com": "10.6.232.17",
        },
        "servers": [
            {
                "domains": [
                    "geosite:cn",
                    "geosite:category-games@cn",
                    "geosite:tld-cn",
                    "geosite:apple-cn",
                    "geosite:google-cn",
                    "geosite:icloud"
                ],
                "port": 53,
                "address": "202.106.0.20"
            },
            {
                "domains": [
                    "domain:int.xxx.com"
                ],
                "expectIPs": [
                    "geoip:private"
                ],
                "port": 53,
                "address": "x.x.x.x"
            },
            {
                "domains": [
                    "geosite:gfw",
                    "geosite:greatfire",
                    "geosite:tld-!cn"
                ],
                "port": 53,
                "address": "8.8.8.8"
            }
        ]
    },
    "log": {
        "access": "/var/log/v2ray/access.log",
        "loglevel": "debug",
        "error": "/var/log/v2ray/error.log"
    },
    "inbounds": [
        {
            "streamSettings": {
                "sockopt": {
                    "tproxy": "tproxy",
                    "mark": 255
                }
            },
            "protocol": "dokodemo-door",
            "settings": {
                "network": "tcp,udp",
                "followRedirect": true
            },
            "sniffing": {
                "destOverride": [
                    "http",
                    "tls"
                ],
                "enabled": true
            },
            "tag": "transparent",
            "port": 12345
        },
        {
            "sniffing": {
                "destOverride": [
                    "http",
                    "tls"
                ],
                "enabled": true
            },
            "protocol": "socks",
            "port": 1080,
            "settings": {
                "auth": "noauth"
            }
        }
    ],
    "routing": {
        "rules": [
            {
                "outboundTag": "dns-out",
                "inboundTag": [
                    "transparent"
                ],
                "type": "field",
                "port": 53,
                "network": "udp"
            },
            {
                "protocol": [
                    "bittorrent"
                ],
                "type": "field",
                "outboundTag": "direct"
            },
            {
                "source": [
                    "10.6.128.0/23"
                ],
                "domain": [
                    "domain:ifconfig.co",
                    "domain:liepin.com"
                ],
                "type": "field",
                "outboundTag": "proxy-hr"
            },
            {
                "domain": [
                    "geosite:tld-!cn",
                    "geosite:gfw",
                    "geosite:greatfire"
                ],
                "type": "field",
                "outboundTag": "proxy"
            },
            {
                "ip": [
                    "1.1.1.1/32",
                    "1.0.0.1/32",
                    "8.8.8.8/32",
                    "8.8.4.4/32",
                    "geoip:us",
                    "geoip:ca",
                    "geoip:telegram"
                ],
                "type": "field",
                "outboundTag": "proxy"
            },
            {
                "type": "field",
                "network": "tcp,udp",
                "outboundTag": "direct"
            }
        ],
        "domainStrategy": "IPOnDemand"
    }
}

```

**客户端配置：**

```javascript
// 在这里附上客户端配置

```

## 请附上出错时软件输出的错误日志

**服务器端错误日志：**

```javascript
// 在这里附上服务器端日志
2021/04/23 09:06:21 [Debug] github.com/v2fly/v2ray-core/v4/transport/internet/udp: UDP original destination: udp:10.6.232.16:53
2021/04/23 09:06:21 [Debug] [727198920] github.com/v2fly/v2ray-core/v4/proxy/dokodemo: processing connection from: 10.6.232.17:49166
2021/04/23 09:06:21 [Info] [727198920] github.com/v2fly/v2ray-core/v4/proxy/dokodemo: received request for 10.6.232.17:49166
2021/04/23 09:06:21 [Info] [727198920] github.com/v2fly/v2ray-core/v4/app/dispatcher: taking detour [dns-out] for [udp:10.6.232.16:53]
2021/04/23 09:06:21 [Info] [727198920] github.com/v2fly/v2ray-core/v4/proxy/dns: handling DNS traffic to udp:10.6.232.16:53
2021/04/23 09:06:21 [Debug] github.com/v2fly/v2ray-core/v4/app/dns: domain www2.baidu.com matches following rules: [geosite:cn(DNS idx:0)]
2021/04/23 09:06:21 [Debug] github.com/v2fly/v2ray-core/v4/app/dns: domain www2.baidu.com will use DNS in order: [UDP:202.106.0.20:53 UDP:10.9.1.151:53 UDP:8
.8.8.8:53]
2021/04/23 09:06:21 [Debug] github.com/v2fly/v2ray-core/v4/app/dns: UDP:202.106.0.20:53 cache HIT www2.baidu.com -> [153.3.236.108]
2021/04/23 09:06:22 [Debug] github.com/v2fly/v2ray-core/v4/app/dns: domain www2.baidu.com matches following rules: [geosite:cn(DNS idx:0)]
2021/04/23 09:06:22 [Debug] github.com/v2fly/v2ray-core/v4/app/dns: domain www2.baidu.com will use DNS in order: [UDP:202.106.0.20:53 UDP:10.9.1.151:53 UDP:8.8.8.8:53]
2021/04/23 09:06:22 [Debug] github.com/v2fly/v2ray-core/v4/app/dns: UDP:202.106.0.20:53 cache HIT www2.baidu.com -> [153.3.236.108]
2021/04/23 09:06:22 [Info] [1155585513] github.com/v2fly/v2ray-core/v4/app/proxyman/inbound: connection ends > github.com/v2fly/v2ray-core/v4/proxy/dokodemo: connection ends > github.com/v2fly/v2ray-core/v4/proxy/dokodemo: failed to transport request (TPROXY conn) > read udp 10.6.232.16:53->10.6.232.17:59980: read: connection refused
2021/04/23 09:06:22 [Info] [1155585513] github.com/v2fly/v2ray-core/v4/app/proxyman/outbound: failed to process outbound traffic > github.com/v2fly/v2ray-core/v4/proxy/dns: connection ends > io: read/write on closed pipe
2021/04/23 09:06:27 [Debug] github.com/v2fly/v2ray-core/v4/app/dns: domain www2.baidu.com matches following rules: [geosite:cn(DNS idx:0)]
2021/04/23 09:06:27 [Debug] github.com/v2fly/v2ray-core/v4/app/dns: domain www2.baidu.com will use DNS in order: [UDP:202.106.0.20:53 UDP:10.9.1.151:53 UDP:8.8.8.8:53]
2021/04/23 09:06:27 [Debug] github.com/v2fly/v2ray-core/v4/app/dns: UDP:202.106.0.20:53 cache HIT www2.baidu.com -> [153.3.236.108]
2021/04/23 09:06:27 [Info] [571194246] github.com/v2fly/v2ray-core/v4/app/proxyman/inbound: connection ends > github.com/v2fly/v2ray-core/v4/proxy/dokodemo: connection ends > github.com/v2fly/v2ray-core/v4/proxy/dokodemo: failed to transport request (TPROXY conn) > read udp 10.6.232.16:53->10.6.232.17:11563: read: connection refused
2021/04/23 09:06:27 [Info] [571194246] github.com/v2fly/v2ray-core/v4/app/proxyman/outbound: failed to process outbound traffic > github.com/v2fly/v2ray-core/v4/proxy/dns: connection ends > io: read/write on closed pipe
2021/04/23 09:06:32 [Debug] github.com/v2fly/v2ray-core/v4/app/dns: domain www2.baidu.com matches following rules: [geosite:cn(DNS idx:0)]
2021/04/23 09:06:32 [Debug] github.com/v2fly/v2ray-core/v4/app/dns: domain www2.baidu.com will use DNS in order: [UDP:202.106.0.20:53 UDP:10.9.1.151:53 UDP:8.8.8.8:53]
2021/04/23 09:06:32 [Debug] github.com/v2fly/v2ray-core/v4/app/dns: UDP:202.106.0.20:53 cache HIT www2.baidu.com -> [153.3.236.108]
2021/04/23 09:06:32 [Info] [2208736237] github.com/v2fly/v2ray-core/v4/app/proxyman/inbound: connection ends > github.com/v2fly/v2ray-core/v4/proxy/dokodemo: connection ends > github.com/v2fly/v2ray-core/v4/proxy/dokodemo: failed to transport request (TPROXY conn) > read udp 10.6.232.16:53->10.6.232.17:57653: read: connection refused
2021/04/23 09:06:32 [Info] [2208736237] github.com/v2fly/v2ray-core/v4/app/proxyman/outbound: failed to process outbound traffic > github.com/v2fly/v2ray-core/v4/proxy/dns: connection ends > io: read/write on closed pipe
2021/04/23 09:06:38 [Debug] github.com/v2fly/v2ray-core/v4/transport/internet/udp: UDP original destination: udp:10.6.232.16:53
2021/04/23 09:06:38 [Debug] [3522990572] github.com/v2fly/v2ray-core/v4/proxy/dokodemo: processing connection from: 10.6.232.17:29396

```

**客户端错误日志：**

```javascript
// 在这里附上客户端日志

```

## 请附上访问日志

```javascript
// 在这里附上服务器端日志
2021/04/23 09:06:14 10.6.232.17:57819 accepted udp:10.6.232.16:53 [dns-out]
2021/04/23 09:06:15 10.6.232.17:30650 accepted udp:10.6.232.16:53 [dns-out]
2021/04/23 09:06:16 10.6.232.17:39486 accepted udp:10.6.232.16:53 [dns-out]
2021/04/23 09:06:18 10.6.232.17:13044 accepted udp:10.6.232.16:53 [dns-out]
2021/04/23 09:06:19 10.6.232.17:46900 accepted udp:10.6.232.16:53 [dns-out]
2021/04/23 09:06:20 10.6.232.17:57896 accepted udp:10.6.232.16:53 [dns-out]
2021/04/23 09:06:21 10.6.232.17:49166 accepted udp:10.6.232.16:53 [dns-out]
2021/04/23 09:06:38 10.6.232.17:29396 accepted udp:10.6.232.16:53 [dns-out]
2021/04/23 09:06:39 10.6.232.17:32281 accepted udp:10.6.232.16:53 [dns-out]
2021/04/23 09:06:40 10.6.232.17:65234 accepted udp:10.6.232.16:53 [dns-out]
2021/04/23 09:06:41 10.6.232.17:60907 accepted udp:10.6.232.16:53 [dns-out]
```

**Comment by dec1985** [comment]
dig +tcp后不再复线上述问题. iptables设置:

**Comment by dec1985** [comment]
回退到较老版本(4.23.4), 完全仿照白话文(https://guide.v2fly.org/app/tproxy.html)配置, dig baidu.com; sleep 0.1;
仍然会有问题:

```
20:03:31.820092 IP 10.6.232.17.26039 > 10.6.232.16.53: 57870+ [1au] A? baidu.com. (38)
20:03:31.820646 IP 10.6.232.16.53 > 10.6.232.17.26039: 57870* 2/0/0 A 220.181.38.148, A 39.156.69.79 (59)
20:03:31.938321 IP 10.6.232.17.31347 > 10.6.232.16.53: 48159+ [1au] A? baidu.com. (38)
20:03:31.938890 IP 10.6.232.16.53 > 10.6.232.17.31347: 48159* 2/0/0 A 220.181.38.148, A 39.156.69.79 (59)
20:03:32.056686 IP 10.6.232.17.11832 > 10.6.232.16.53: 15896+ [1au] A? baidu.com. (38)
20:03:32.057141 IP 10.6.232.16.53 > 10.6.232.17.11832: 15896* 2/0/0 A 220.181.38.148, A 39.156.69.79 (59)
20:03:32.174931 IP 10.6.232.17.54958 > 10.6.232.16.53: 20142+ [1au] A? baidu.com. (38)
20:03:32.175479 IP 10.6.232.16.53 > 10.6.232.17.54958: 20142* 2/0/0 A 220.181.38.148, A 39.156.69.79 (59)
20:03:32.293303 IP 10.6.232.17.53074 > 10.6.232.16.53: 20205+ [1au] A? baidu.com. (38)
20:03:32.293802 IP 10.6.232.16.53 > 10.6.232.17.53074: 20205* 2/0/0 A 220.181.38.148, A 39.156.69.79 (59)
20:03:32.411593 IP 10.6.232.17.28463 > 10.6.232.16.53: 3668+ [1au] A? baidu.com. (38)
20:03:32.411810 IP 10.6.232.16.53 > 10.6.232.17.52438: 3668* 2/0/0 A 220.181.38.148, A 39.156.69.79 (59)
20:03:32.411923 IP 10.6.232.17 > 10.6.232.16: ICMP 10.6.232.17 udp port 52438 unreachable, length 95
20:03:37.411451 IP 10.6.232.17.28463 > 10.6.232.16.53: 3668+ [1au] A? baidu.com. (38)
20:03:37.411703 IP 10.6.232.16.53 > 10.6.232.17.52438: 3668* 2/0/0 A 220.181.38.148, A 39.156.69.79 (59)
20:03:37.411854 IP 10.6.232.17 > 10.6.232.16: ICMP 10.6.232.17 udp port 52438 unreachable, length 95
20:03:42.411581 IP 10.6.232.17.28463 > 10.6.232.16.53: 3668+ [1au] A? baidu.com. (38)
20:03:42.411818 IP 10.6.232.16.53 > 10.6.232.17.65199: 3668* 2/0/0 A 220.181.38.148, A 39.156.69.79 (59)
20:03:42.411964 IP 10.6.232.17 > 10.6.232.16: ICMP 10.6.232.17 udp port 65199 unreachable, length 95
20:03:47.530152 IP 10.6.232.17.55124 > 10.6.232.16.53: 23756+ [1au] A? baidu.com. (38)
20:03:47.530741 IP 10.6.232.16.53 > 10.6.232.17.55124: 23756* 2/0/0 A 220.181.38.148, A 39.156.69.79 (59)
20:03:47.648978 IP 10.6.232.17.42955 > 10.6.232.16.53: 6071+ [1au] A? baidu.com. (38)
20:03:47.649509 IP 10.6.232.16.53 > 10.6.232.17.42955: 6071* 2/0/0 A 220.181.38.148, A 39.156.69.79 (59)
20:03:47.767449 IP 10.6.232.17.48705 > 10.6.232.16.53: 29907+ [1au] A? baidu.com. (38)
20:03:47.767905 IP 10.6.232.16.53 > 10.6.232.17.48705: 29907* 2/0/0 A 220.181.38.148, A 39.156.69.79 (59)
20:03:47.885691 IP 10.6.232.17.50871 > 10.6.232.16.53: 50589+ [1au] A? baidu.com. (38)
20:03:47.886211 IP 10.6.232.16.53 > 10.6.232.17.50871: 50589* 2/0/0 A 220.181.38.148, A 39.156.69.79 (59)
```

**Comment by sixg0000d** [comment]
监听 10.6.232.16:53 的是什么进程 / 程序？

**Comment by dec1985** [comment]
> 监听 10.6.232.16:53 的是什么进程 / 程序？

其实没有, 就是iptables把打过来的请求(53 udp)tproxy转发到127.0.0.1:12345, 然后routing匹配到dns-out.

**Comment by sixg0000d** [comment]
> > 监听 10.6.232.16:53 的是什么进程 / 程序？
> 
> 其实没有, 就是iptables把打过来的请求(53 udp)tproxy转发到127.0.0.1:12345, 然后routing匹配到dns-out.

但是你 dig 时的 dns 服务器不是 v2ray ，v2ray 只能从内部处理内部的 dns 请求，其对于外部是不可见的，按理来说也不会影响到端口
我认为可能是你的本地的某个 dns 服务器 / 服务造成的（比如 dnsmasq / systemd-resolved 之类的）

你可以试试把 routing 里

```json
            {
                "outboundTag": "dns-out",
                "inboundTag": [
                    "transparent"
                ],
                "type": "field",
                "port": 53,
                "network": "udp"
            }
```

这一段删了看能否复现？
